{
  "manifestVersion": "1.0",
  "exportJobId": "11111111-1111-1111-1111-111111111111",
  "datasetRecordType": "EquipmentLifecycleContextV1",
  "schemaVersion": "1.0",
  "exportFormat": "NDJSON",
  "encoding": "UTF-8",
  "lineEnding": "LF",
  "createdAt": "2026-07-31T09:00:00Z",
  "startedAt": "2026-07-31T09:00:01Z",
  "completedAt": "2026-07-31T09:05:00Z",
  "asOf": "2026-07-31T09:00:00Z",
  "contextProfile": "standard-v1",
  "resolvedPolicy": {
    "historyStart": "2021-08-01T09:00:00Z",
    "futurePlanningHorizon": 31536000,
    "includedSections": ["WORK_ORDERS"],
    "maxRowsBySection": { "WORK_ORDERS": 500 },
    "measurementGranularity": "RAW"
  },
  "requestFingerprint": "aaaaaaaaaaaaaaaaaaaaaaaaaaaaaaaaaaaaaaaaaaaaaaaaaaaaaaaaaaaaaaaa",
  "policyFingerprint": "bbbbbbbbbbbbbbbbbbbbbbbbbbbbbbbbbbbbbbbbbbbbbbbbbbbbbbbbbbbbbbbb",
  "selectionMode": "EXPLICIT_IDS",
  "selectedCount": 2,
  "exportedRecordCount": 2,
  "datasetByteSize": 2048,
  "finalizedInputs": [
    {
      "filename": "equipment-lifecycle-context-v1.ndjson",
      "mediaType": "application/x-ndjson",
      "size": 2048,
      "sha256": "cccccccccccccccccccccccccccccccccccccccccccccccccccccccccccccccc"
    },
    {
      "filename": "equipment-lifecycle-context-v1.schema.json",
      "mediaType": "application/schema+json",
      "size": 4096,
      "sha256": "dddddddddddddddddddddddddddddddddddddddddddddddddddddddddddddddd"
    }
  ],
  "contextVersionAlgorithm": "W1_DETERMINISTIC_CANONICAL_JSON_SHA256",
  "orderingRule": "FROZEN_MEMBERSHIP_ORDINAL_ASC",
  "truncationAndDataQualitySummary": {
    "recordLevelDataQualityPreserved": true,
    "recordLevelSectionTruncationMetadataPreserved": true
  },
  "consistency": {
    "model": "FIXED_AS_OF_WITH_FROZEN_EQUIPMENT_SELECTION_AND_READ_COMMITTED_SOURCE_READS",
    "equipmentMembershipFrozen": true,
    "singleDatabaseSnapshot": false,
    "transactionIsolation": "READ_COMMITTED",
    "sourceRowsMayChangeDuringExport": true,
    "traceability": "Each W1 record retains its context fingerprint and source watermarks"
  },
  "expiresAt": "2026-08-07T09:05:00Z",
  "warnings": [
    "No single MVCC snapshot spans this export",
    "Source rows may change while a long export is running"
  ]
}
